{
  "session_id": "20260624-v05-marketing-copy-demo",
  "round": 1,
  "fields": {
    "artifact_type": {"value": "营销文案", "evidence": "用户原话: 评审这段朋友圈营销文案", "sufficient": true},
    "artifact_locator": {"value": "tests/fixtures/marketing_copy_demo/copy.md", "evidence": "用户原话: tests/fixtures/marketing_copy_demo/copy.md", "sufficient": true},
    "target_audience": {"value": "三线城市宝妈消费者", "evidence": "用户原话: 给三线城市宝妈看", "sufficient": true},
    "key_concern": {"value": "流失", "evidence": "用户原话: 重点看哪里会让人划走或反感", "sufficient": true},
    "distribution_intent": {"value": "specified_personas", "evidence": "用户指定消费者陪审员", "sufficient": true}
  },
  "consistency_check": {"passed": true, "conflicts": []},
  "boundary_ack": {
    "no_absolute_metrics_predicted": true,
    "no_go_no_go_decision": true,
    "fit_fidelity_disclaimer": true,
    "ask_dont_hallucinate": true
  },
  "verdict": "SUFFICIENT",
  "next_action": {
    "kind": "PROCEED_TO_DAG",
    "summary_for_user": "评审对象是朋友圈营销文案,目标受众为三线城市宝妈消费者,重点看反感和流失风险。"
  }
}
