{
  "session_id": "20260624-v04-screen-demo",
  "round": 1,
  "fields": {
    "artifact_type": {"value": "单界面", "evidence": "用户原话: 评一下这个单界面截图", "sufficient": true},
    "artifact_locator": {"value": "tests/fixtures/screen_demo/screen.md", "evidence": "用户原话: tests/fixtures/screen_demo/screen.md", "sufficient": true},
    "target_audience": {"value": "三线城市餐饮商家", "evidence": "用户原话: 给三线城市餐饮商家看", "sufficient": true},
    "key_concern": {"value": "转化效果", "evidence": "用户原话: 重点看会不会影响转化", "sufficient": true},
    "distribution_intent": {"value": "specified_personas", "evidence": "用户指定专家陪审员", "sufficient": true}
  },
  "consistency_check": {"passed": true, "conflicts": []},
  "boundary_ack": {
    "no_absolute_metrics_predicted": true,
    "no_go_no_go_decision": true,
    "fit_fidelity_disclaimer": true,
    "ask_dont_hallucinate": true
  },
  "verdict": "SUFFICIENT",
  "next_action": {
    "kind": "PROCEED_TO_DAG",
    "summary_for_user": "评审对象是单界面截图,目标受众为三线城市餐饮商家,重点看转化风险。"
  }
}
