{
  "session_id": "20260624-v05-detail-page-demo",
  "round": 1,
  "fields": {
    "artifact_type": {"value": "详情页", "evidence": "用户原话: 评审这个团购详情页", "sufficient": true},
    "artifact_locator": {"value": "tests/fixtures/detail_page_demo/detail.md", "evidence": "用户原话: tests/fixtures/detail_page_demo/detail.md", "sufficient": true},
    "target_audience": {"value": "本地餐饮团购消费者", "evidence": "用户原话: 给本地餐饮团购消费者看", "sufficient": true},
    "key_concern": {"value": "转化效果", "evidence": "用户原话: 重点看下单前会不会被劝退", "sufficient": true},
    "distribution_intent": {"value": "specified_personas", "evidence": "用户指定消费者与专家陪审员", "sufficient": true}
  },
  "consistency_check": {"passed": true, "conflicts": []},
  "boundary_ack": {
    "no_absolute_metrics_predicted": true,
    "no_go_no_go_decision": true,
    "fit_fidelity_disclaimer": true,
    "ask_dont_hallucinate": true
  },
  "verdict": "SUFFICIENT",
  "next_action": {
    "kind": "PROCEED_TO_DAG",
    "summary_for_user": "评审对象是团购详情页,目标受众为本地餐饮团购消费者,重点看下单前的转化风险。"
  }
}
