{
  "session_id": "20260624-v04-design-demo",
  "round": 1,
  "fields": {
    "artifact_type": {"value": "设计稿", "evidence": "用户原话: 评一下这版设计稿", "sufficient": true},
    "artifact_locator": {"value": "tests/fixtures/design_demo/design.md", "evidence": "用户原话: tests/fixtures/design_demo/design.md", "sufficient": true},
    "target_audience": {"value": "新手本地推广告主", "evidence": "用户原话: 给新手本地推广告主看", "sufficient": true},
    "key_concern": {"value": "设计合理性", "evidence": "用户原话: 重点看信息架构和理解成本", "sufficient": true},
    "distribution_intent": {"value": "specified_personas", "evidence": "用户指定专家陪审员", "sufficient": true}
  },
  "consistency_check": {"passed": true, "conflicts": []},
  "boundary_ack": {
    "no_absolute_metrics_predicted": true,
    "no_go_no_go_decision": true,
    "fit_fidelity_disclaimer": true,
    "ask_dont_hallucinate": true
  },
  "verdict": "SUFFICIENT",
  "next_action": {
    "kind": "PROCEED_TO_DAG",
    "summary_for_user": "评审对象是设计稿,目标受众为新手本地推广告主,重点看信息架构和理解成本。"
  }
}
