{
  "session_id": "20260624-v05-product-card-demo",
  "round": 1,
  "fields": {
    "artifact_type": {"value": "商品卡", "evidence": "用户原话: 评审直播间商品卡", "sufficient": true},
    "artifact_locator": {"value": "tests/fixtures/product_card_demo/card.md", "evidence": "用户原话: tests/fixtures/product_card_demo/card.md", "sufficient": true},
    "target_audience": {"value": "直播间本地生活消费者", "evidence": "用户原话: 给直播间本地生活消费者看", "sufficient": true},
    "key_concern": {"value": "转化效果", "evidence": "用户原话: 重点看会不会想点商品卡", "sufficient": true},
    "distribution_intent": {"value": "specified_personas", "evidence": "用户指定消费者陪审员", "sufficient": true}
  },
  "consistency_check": {"passed": true, "conflicts": []},
  "boundary_ack": {
    "no_absolute_metrics_predicted": true,
    "no_go_no_go_decision": true,
    "fit_fidelity_disclaimer": true,
    "ask_dont_hallucinate": true
  },
  "verdict": "SUFFICIENT",
  "next_action": {
    "kind": "PROCEED_TO_DAG",
    "summary_for_user": "评审对象是直播间商品卡,目标受众为本地生活消费者,重点看点击商品卡的转化阻力。"
  }
}
